{
  "schema_name": "interlanguage.modular-backend-supplement",
  "schema_version": "0.1.0",
  "snapshot_at": "2026-08-23T00:00:00+02:00",
  "binding_state": "final",
  "machine_backend_evidence": {
    "path": "00_control/MACHINE_BACKEND_EVIDENCE.json",
    "bytes": 163890,
    "sha256": "60d81807fd9874b227ec5e0f343d2d30d50b1c6e22b0dc9f66b5e97212bd8691",
    "schema_path": "backend/schema/machine-backend-evidence-v0.schema.json"
  },
  "updates": {
    "editions": [
      {
        "id": "edition.r017.id-id.draft",
        "status": "visually_checked"
      },
      {
        "id": "edition.o018.id-id.draft",
        "status": "mathematically_reviewed"
      }
    ],
    "root_units": [
      {"id": "unit.r017.book1", "translation_state": "visually_checked", "status": "verified"},
      {"id": "unit.r017.book1.frontmatter", "translation_state": "language_reviewed", "status": "verified"},
      {"id": "unit.r017.book1.introduction", "translation_state": "mathematically_reviewed", "status": "verified"},
      {"id": "unit.r017.book1.ch01", "translation_state": "mathematically_reviewed", "status": "verified"},
      {"id": "unit.r017.book1.ch02", "translation_state": "mathematically_reviewed", "status": "verified"},
      {"id": "unit.r017.book1.ch03", "translation_state": "mathematically_reviewed", "status": "verified"}
    ],
    "term_status_updates": [
      {"id": "term.additivity.id", "status": "approved"},
      {"id": "term.assignment.id", "status": "approved"},
      {"id": "term.binary-integer-programming.id", "status": "approved"},
      {"id": "term.binding-constraint.id", "status": "approved"},
      {"id": "term.cell.id", "status": "approved"},
      {"id": "term.certainty.id", "status": "approved"},
      {"id": "term.conditional-formatting.id", "status": "approved"},
      {"id": "term.constraint.id", "status": "approved"},
      {"id": "term.convex.id", "status": "approved"},
      {"id": "term.data-validation.id", "status": "approved"},
      {"id": "term.decision-variable.id", "status": "approved"},
      {"id": "term.divisibility.id", "status": "approved"},
      {"id": "term.excel-solver.id", "status": "approved"},
      {"id": "term.feasible-region.id", "status": "approved"},
      {"id": "term.free-variable.id", "status": "approved"},
      {"id": "term.knapsack.id", "status": "approved"},
      {"id": "term.learning-outcomes.id", "concept_id": "concept.learning-outcomes", "status": "approved"},
      {"id": "term.linear-programming.id", "status": "approved"},
      {"id": "term.loss-function.id", "concept_id": "concept.loss-function", "status": "approved"},
      {"id": "term.lp-relaxation.id", "status": "approved"},
      {"id": "term.mathematical-programming.id", "status": "approved"},
      {"id": "term.mixed-integer-linear-programming.id", "status": "approved"},
      {"id": "term.modeling.id", "concept_id": "concept.modeling", "status": "approved"},
      {"id": "term.nonconvex.id", "status": "approved"},
      {"id": "term.nonlinear-programming.id", "status": "approved"},
      {"id": "term.np-hard.id", "status": "approved"},
      {"id": "term.objective-function.id", "status": "approved"},
      {"id": "term.operations-research.id", "status": "approved"},
      {"id": "term.optimization.id", "concept_id": "concept.optimization", "status": "approved"},
      {"id": "term.proportionality.id", "status": "approved"},
      {"id": "term.range.id", "status": "approved"},
      {"id": "term.robust-optimization.id", "status": "approved"},
      {"id": "term.shadow-price.id", "status": "approved"},
      {"id": "term.slack.id", "status": "approved"},
      {"id": "term.solver.id", "concept_id": "concept.solver", "status": "approved"},
      {"id": "term.stochastic-optimization.id", "status": "approved"},
      {"id": "term.transportation.id", "status": "approved"},
      {"id": "term.worksheet.id", "status": "approved"}
    ],
    "rights": [
      {
        "id": "rights.thirdparty.foundations",
        "compatibility_note": "The pinned attribution names CC BY 3.0 US, retains the source and authors, and records the adapter's-license provision used for the CC BY-SA 4.0 edition; the exact source notice remains included.",
        "status": "verified_from_pinned_attribution"
      }
    ],
    "file_units": [
      {
        "id": "unit.r017.book1.sources",
        "expected_target_sha256": "192be142382caa6a7eac6aad0c2bb2830ca36e9713179d2ad0be4b24a11bc017",
        "target_only_blocks": [
          {
            "target_block_index": 19,
            "id": "segment.r017.book1.sources.target-only-cleardoublepage",
            "segment_type": "layout_control",
            "provenance": "Target-native final verso boundary retained by the localized reader assembly; it adds no reader-visible attribution prose.",
            "native_reason": "Preserve the final frontmatter page boundary after the independently repaired attribution block."
          }
        ]
      },
      {
        "id": "unit.r017.book1.ch04.text-b",
        "expected_target_sha256": "cb07632203302bd695426880f491a496e67cf2f9504a25231988a8ea6a767eb4"
      },
      {
        "id": "unit.r017.book1.ch06.text",
        "expected_target_sha256": "4e08b0c7d3b5e89a868800569eeb57b9128d6b1b009301ce0cd2fcae9c2e75ca"
      },
      {
        "id": "unit.r017.book1.ch07.text",
        "expected_target_sha256": "42c1640cd736a36e55d812fa58c696edbaa56958b02a2cd17c2cc301d0b30179"
      }
    ],
    "concept_additions": [
      {"id": "concept.learning-outcomes", "name_en": "learning outcomes", "prerequisite_concept_ids": [], "status": "active"},
      {"id": "concept.loss-function", "name_en": "loss function", "prerequisite_concept_ids": [], "status": "active"},
      {"id": "concept.modeling", "name_en": "modeling", "prerequisite_concept_ids": [], "status": "active"},
      {"id": "concept.optimization", "name_en": "optimization", "prerequisite_concept_ids": [], "status": "active"},
      {"id": "concept.solver", "name_en": "solver", "prerequisite_concept_ids": ["concept.optimization"], "status": "active"}
    ],
    "term_additions": [
      {"id": "term.absolute-value-linearization.id", "concept_id": "concept.absolute-value-linearization", "source_locale": "en", "source_term": "absolute-value linearization", "target_locale": "id-ID", "preferred": "linearisasi nilai mutlak", "variants": [], "rejected": [], "scope": "R017/O018 Book 1 full-corpus edition", "register": "academic", "evidence": "Final id-ID corpus terminology audit", "status": "approved"},
      {"id": "term.capital-allocation.id", "concept_id": "concept.capital-allocation", "source_locale": "en", "source_term": "capital-allocation model", "target_locale": "id-ID", "preferred": "model alokasi modal", "variants": [], "rejected": [], "scope": "R017/O018 Book 1 full-corpus edition", "register": "academic", "evidence": "Final id-ID corpus terminology audit", "status": "approved"},
      {"id": "term.diet-problem.id", "concept_id": "concept.diet-problem", "source_locale": "en", "source_term": "diet problem", "target_locale": "id-ID", "preferred": "masalah diet", "variants": [], "rejected": [], "scope": "R017/O018 Book 1 full-corpus edition", "register": "academic", "evidence": "Final id-ID corpus terminology audit", "status": "approved"},
      {"id": "term.expected-value-objective.id", "concept_id": "concept.expected-value-objective", "source_locale": "en", "source_term": "expected-value objective", "target_locale": "id-ID", "preferred": "fungsi tujuan nilai harapan", "variants": [], "rejected": [], "scope": "R017/O018 Book 1 full-corpus edition", "register": "academic", "evidence": "Final id-ID corpus terminology audit", "status": "approved"},
      {"id": "term.integer-linear-programming.id", "concept_id": "concept.integer-linear-programming", "source_locale": "en", "source_term": "integer linear programming", "target_locale": "id-ID", "preferred": "pemrograman linear bilangan bulat", "variants": [], "rejected": [], "scope": "R017/O018 Book 1 full-corpus edition", "register": "academic", "evidence": "Final id-ID corpus terminology audit", "status": "approved"},
      {"id": "term.machine-learning-optimization.id", "concept_id": "concept.machine-learning-optimization", "source_locale": "en", "source_term": "optimization in machine learning", "target_locale": "id-ID", "preferred": "optimisasi dalam pembelajaran mesin", "variants": [], "rejected": [], "scope": "R017/O018 Book 1 full-corpus edition", "register": "academic", "evidence": "Final id-ID corpus terminology audit", "status": "approved"},
      {"id": "term.mixed-integer-nonlinear-programming.id", "concept_id": "concept.mixed-integer-nonlinear-programming", "source_locale": "en", "source_term": "mixed-integer nonlinear programming", "target_locale": "id-ID", "preferred": "pemrograman nonlinier bilangan bulat campuran", "variants": [], "rejected": [], "scope": "R017/O018 Book 1 full-corpus edition", "register": "academic", "evidence": "Final id-ID corpus terminology audit", "status": "approved"},
      {"id": "term.model-development-cycle.id", "concept_id": "concept.model-development-cycle", "source_locale": "en", "source_term": "model development cycle", "target_locale": "id-ID", "preferred": "siklus pengembangan model", "variants": [], "rejected": [], "scope": "R017/O018 Book 1 full-corpus edition", "register": "academic", "evidence": "Final id-ID corpus terminology audit", "status": "approved"},
      {"id": "term.optimization-model.id", "concept_id": "concept.optimization-model", "source_locale": "en", "source_term": "optimization model", "target_locale": "id-ID", "preferred": "model optimisasi", "variants": [], "rejected": [], "scope": "R017/O018 Book 1 full-corpus edition", "register": "academic", "evidence": "Final id-ID corpus terminology audit", "status": "approved"},